{
  "schemaVersion": 3,
  "appVersion": "3.0",
  "generatedAt": "2026-08-08T13:54:00-04:00",
  "searchName": "Fluxology T176 trades job scout",
  "currency": "CAD",
  "listings": [
    {
      "id": "job-tsv-ironworks-welder-helper",
      "title": "Welder Helper",
      "employer": "TSV Ironworks Ltd",
      "company": "TSV Ironworks Ltd",
      "lane": "welding",
      "tracks": [
        "welding"
      ],
      "primaryTrack": "welding",
      "verdict": "APPLY",
      "careerFitScore": 9,
      "fitScore": 90,
      "shortlistChance": "~25-45% (estimate)",
      "pay": "$17.60-$22.00/hour",
      "salaryText": "$17.60-$22.00/hour",
      "employmentType": "Full-time",
      "location": "Mississauga, ON",
      "schedule": "Full-time; shifts not specified",
      "url": "https://www.jobbank.gc.ca/jobsearch/jobposting/50097174",
      "source": "Job Bank (cross-posted on SimplyHired and Indeed; apply link goes to Indeed)",
      "employerDirectVerified": false,
      "whyT176": "Assist welders with cutting, grinding and cleaning metal, component assembly, plasma cutting under supervision, crane/forklift material handling, blueprint familiarity - direct Semester-1 welding reinforcement in a structural steel shop.",
      "mainGate": "'Welding: 2 years' is listed as preferred (asset, not a hard gate); full-time hours must be squared with the class timetable.",
      "applicationAngle": "Lead with T176 welding coursework and shop-tool competence; emphasize willingness to do prep/grind work and flexible availability. Posted Aug 17 - apply fast.",
      "status": "tracked",
      "active": true,
      "firstSeen": "2026-08-22T20:07:45Z",
      "lastSeen": "2026-08-22T20:07:45Z",
      "lastVerified": "2026-08-22T20:07:45Z",
      "lastChanged": "2026-08-22T20:07:45Z"
    },
    {
      "id": "job-trench-canada-welder-apprentice",
      "title": "Welder Apprentice (Union)",
      "employer": "Trench Canada (Trench Group)",
      "company": "Trench Canada (Trench Group)",
      "lane": "welding",
      "tracks": [
        "welding"
      ],
      "primaryTrack": "welding",
      "verdict": "STRETCH",
      "careerFitScore": 9,
      "fitScore": 90,
      "shortlistChance": "~5-20% (estimate)",
      "pay": "$29.47-$31.78/hour (union rate)",
      "salaryText": "$29.47-$31.78/hour (union rate)",
      "employmentType": "Full-time, union",
      "location": "Scarborough, ON",
      "schedule": "Full-time; shifts not specified",
      "url": "https://www.glassdoor.ca/job-listing/welder-trench-JV_IC2281799_KO0,6_KE7,13.htm?jl=1009883738135",
      "source": "Glassdoor/ZipRecruiter/Workopolis mirrors; employer ATS is trench.csod.com (portal live, but this run could not re-verify the posting inside it - mirrors returned 403)",
      "employerDirectVerified": false,
      "whyT176": "Union welder apprenticeship at a high-voltage transformer manufacturer - manual and robotic welding machines, formal apprenticeship pathway, recognized union training. Highest career-capital role found.",
      "mainGate": "Board mirrors label it 'Mid-Level (3+ years)' and it was posted ~Jul 24, so it may prefer experienced apprentices or already be filled; posting could not be re-verified live this run.",
      "applicationAngle": "STRETCH rationale: 'Apprentice' title plus union pathway, and no verified mandatory licence/years gate - worth applying despite the experience label. Apply through the Trench careers portal (trench.csod.com) and name T176 enrollment as apprenticeship readiness.",
      "status": "tracked",
      "active": true,
      "firstSeen": "2026-08-22T20:07:45Z",
      "lastSeen": "2026-08-22T20:07:45Z",
      "lastVerified": "2026-08-22T20:07:45Z",
      "lastChanged": "2026-08-22T20:07:45Z"
    },
    {
      "id": "job-jk-cryogenics-apprentice-welder-helper",
      "title": "Apprentice Welder/Helper",
      "employer": "J.K. Cryogenics (J.K. Quality Welding Inc.)",
      "company": "J.K. Cryogenics (J.K. Quality Welding Inc.)",
      "lane": "welding",
      "tracks": [
        "welding",
        "plumbing"
      ],
      "primaryTrack": "welding",
      "verdict": "MAYBE",
      "careerFitScore": 9,
      "fitScore": 90,
      "shortlistChance": "~30-50% (estimate)",
      "pay": "$18.00-$19.50/hour",
      "salaryText": "$18.00-$19.50/hour",
      "employmentType": "Full-time (per board listing)",
      "location": "Newmarket, ON",
      "schedule": "Not specified",
      "url": "https://www.glassdoor.ca/job-listing/apprentice-welder-helper-jk-cryogenics-dojk-quality-welding-inc-JV_IC2288389_KO0,24_KE25,63.htm?jl=1010071470234",
      "source": "Glassdoor (Easy Apply); employer site jkqualitywelding.com has no careers page",
      "employerDirectVerified": false,
      "whyT176": "True entry apprentice-helper: basic MIG/TIG, blueprint reading, calipers/dimensional inspection - at a cryogenic piping and welding shop, so it touches BOTH Semester-1 trades (welding + piping).",
      "mainGate": "Commute: Newmarket from Dovercourt/Bloor is roughly 1.5-2h each way by transit (GO/Viva) - a substantial daily burden.",
      "applicationAngle": "Easy Apply on Glassdoor; pitch the welding+piping double fit and genuine entry-level expectations ($18-19.50 signals a training wage, not an experience gate).",
      "status": "tracked",
      "active": true,
      "firstSeen": "2026-08-22T20:07:45Z",
      "lastSeen": "2026-08-22T20:07:45Z",
      "lastVerified": "2026-08-22T20:07:45Z",
      "lastChanged": "2026-08-22T20:07:45Z"
    },
    {
      "id": "job-atkore-sasco-spot-welder-apprentice",
      "title": "Spot Welder Apprentice",
      "employer": "Atkore (Sasco division)",
      "company": "Atkore (Sasco division)",
      "lane": "welding",
      "tracks": [
        "welding",
        "machine-shop"
      ],
      "primaryTrack": "welding",
      "verdict": "MAYBE",
      "careerFitScore": 7,
      "fitScore": 70,
      "shortlistChance": "~15-35% (estimate)",
      "pay": "CAD $30.24/hour + extended health benefits and life insurance",
      "salaryText": "CAD $30.24/hour + benefits",
      "employmentType": "Regular full-time",
      "location": "North York, ON",
      "schedule": "Mon-Fri 7:30-16:00",
      "url": "https://ca.talent.com/view?id=628840495517272876",
      "source": "talent.com (Atkore careers page not re-verified this run); posting 30+ days old - repost risk",
      "employerDirectVerified": false,
      "whyT176": "Supervised operation of spot-welding and similar plant machinery with explicit train-up intent ('able to be taught'), LOTO/machine-guarding safety exposure, Lean manufacturing environment.",
      "mainGate": "Fixed Mon-Fri 7:30-16:00 hours conflict with full-time daytime study; 1-2 years manufacturing/fabrication experience is preferred; spot welding is narrower than fabrication welding.",
      "applicationAngle": "Only pursue if the timetable can absorb weekday day shifts (e.g. evening-weighted semester); emphasize manufacturing safety mindset and trainability.",
      "status": "tracked",
      "active": true,
      "firstSeen": "2026-08-22T20:07:45Z",
      "lastSeen": "2026-08-22T20:07:45Z",
      "lastVerified": "2026-08-22T20:07:45Z",
      "lastChanged": "2026-08-22T20:07:45Z"
    },
    {
      "id": "job-rezi-plumbing-plumber-helper",
      "title": "Plumber Helper",
      "employer": "REZI Plumbing & Heating Inc.",
      "company": "REZI Plumbing & Heating Inc.",
      "lane": "plumbing",
      "tracks": [
        "plumbing"
      ],
      "primaryTrack": "plumbing",
      "verdict": "MAYBE",
      "careerFitScore": 5,
      "fitScore": 50,
      "shortlistChance": "~30-55% (estimate)",
      "pay": "$18.50/hour",
      "salaryText": "$18.50/hour",
      "employmentType": "Permanent, full-time (30-35 h/week), 2 vacancies",
      "location": "Woodbridge, ON (140 Regina Rd, L4L 8N1)",
      "schedule": "Morning, day, or evening shifts",
      "url": "https://www.jobbank.gc.ca/jobsearch/jobposting/49716272",
      "source": "Job Bank (direct apply via Job Bank account)",
      "employerDirectVerified": false,
      "whyT176": "The only accessible GTA plumbing-helper entry point this run: plumbing contractor environment, 1-7 months experience accepted, shift options that can fit a class timetable.",
      "mainGate": "Posted duties read as general construction labour (concrete forms, asphalt, traffic direction) rather than piping - actual plumbing exposure is uncertain. Expires Sep 4.",
      "applicationAngle": "Apply via Job Bank before Sep 4; in the application, ask what share of the work is hands-on plumbing/piping and state evening/weekend availability.",
      "status": "tracked",
      "active": true,
      "firstSeen": "2026-08-22T20:07:45Z",
      "lastSeen": "2026-08-22T20:07:45Z",
      "lastVerified": "2026-08-22T20:07:45Z",
      "lastChanged": "2026-08-22T20:07:45Z"
    }
  ]
}